{
  "$schema": "http://json-schema.org/draft-07/schema#",
  "$id": "https://github.com/Ilya-Garanov-WorkingAcc/Safe-Dev-Plugin-for-CC/policy.schema.json",
  "title": "secure-dev policy",
  "description": "Политика отдела. Версионируется в git вместе с плагином; личный файл ~/.claude/secure-dev.local.json может только ужесточать её (ADR-008). Схема — публичный контракт: валидируется `secure-dev doctor`, редакторы подхватывают её по $schema.",
  "type": "object",
  "required": ["schema_version", "policy_version", "level"],
  "additionalProperties": false,
  "properties": {
    "$schema": { "type": "string" },
    "schema_version": { "const": 1 },
    "policy_version": {
      "type": "string",
      "description": "Человекочитаемая версия набора правил, попадает в heartbeat."
    },
    "level": {
      "enum": ["audit", "warn", "strict"],
      "description": "Уровень по умолчанию для правил, не перечисленных в rule_levels."
    },
    "rule_levels": {
      "type": "object",
      "description": "Ключ — id правила либо его class. Более точный ключ (id) выигрывает у класса.",
      "additionalProperties": { "enum": ["audit", "warn", "strict"] }
    },
    "protected_branches": {
      "type": "array",
      "items": { "type": "string" },
      "description": "Глобы веток, для которых force-push считается HIGH (git-push-force-protected)."
    },
    "exclusions": {
      "type": "array",
      "items": { "type": "string" },
      "description": "Глобы путей, исключённых из проверок содержимого (тесты, фикстуры, моки)."
    },
    "exemptions": {
      "type": "array",
      "description": "Точечные исключения. Читаются ТОЛЬКО отсюда: исключение, которое сотрудник выписывает себе сам, исключением не является.",
      "items": {
        "type": "object",
        "required": ["rule", "reason", "expires", "approved_by"],
        "additionalProperties": false,
        "properties": {
          "rule": { "type": "string" },
          "target_glob": { "type": "string" },
          "reason": { "type": "string" },
          "expires": {
            "type": "string",
            "pattern": "^\\d{4}-\\d{2}-\\d{2}$",
            "description": "YYYY-MM-DD. Просроченное исключение игнорируется и пишет EXEMPTION_EXPIRED — иначе исключения зависают навсегда."
          },
          "approved_by": { "type": "string" }
        }
      }
    },
    "session_memory": {
      "type": "object",
      "additionalProperties": false,
      "properties": {
        "enabled": { "type": "boolean" },
        "ttl_hours": { "type": "number", "minimum": 0 }
      }
    },
    "llm": {
      "type": "object",
      "additionalProperties": false,
      "description": "Второй слой детекции через нативные prompt-хуки (ADR-006). На пилоте выключен.",
      "properties": {
        "enabled": { "type": "boolean" },
        "model": { "type": "string" },
        "max_calls_per_session": { "type": "integer", "minimum": 0 }
      }
    },
    "audit": {
      "type": "object",
      "additionalProperties": false,
      "properties": {
        "retention_days": { "type": "integer", "minimum": 1 },
        "export": {
          "type": "object",
          "additionalProperties": false,
          "properties": {
            "type": { "enum": ["none", "file", "http"] },
            "path": { "type": ["string", "null"] },
            "url": { "type": ["string", "null"] },
            "token_env": {
              "type": ["string", "null"],
              "description": "Имя переменной окружения с токеном. Сам токен в политике не хранится."
            }
          }
        }
      }
    },
    "ui": {
      "type": "object",
      "additionalProperties": false,
      "properties": {
        "banner": { "type": "boolean" },
        "verbosity": { "enum": ["quiet", "normal", "verbose"] }
      }
    }
  }
}
